{
  "schemaVersion": 1,
  "attemptId": "attempt-c1f9eaa4-9192-4339-9db4-cad4d5e6ee49",
  "parentInvocationId": "promptiris-final9-20260915",
  "taskId": ".scratch/harness-integrity/issues/05-independent-roles.md",
  "baseRevision": "40260e2ed3f3ca9251e47c3fd3ec235df2bec4ee",
  "candidateRevision": "sha256:dafdbbc3b7f59069268f1a6c217845a1e1a5942cdcbaa75de43f5a11861838a7",
  "implementerId": "codex-role-orchestrator",
  "producerId": "luna-harden-final9",
  "role": "hardener",
  "modelClass": "quick",
  "promptId": "hardener-v1",
  "promptRef": "tooling/roles/prompts/hardener.md",
  "promptDigest": "sha256:cfdc50a75dd9463f10906d4d676ed1bef51f5f5ae78a73777146a000ba28fa42",
  "sourceAccessMode": "attack-surfaces",
  "inputs": [
    {
      "kind": "work-item",
      "ref": ".scratch/harness-integrity/issues/05-independent-roles.md",
      "digest": "sha256:0768a7fc19ef33520efc117e2aa92f0520a9c842f416be2c7b47b6be29abea66"
    },
    {
      "kind": "candidate-diff",
      "ref": ".scratch/harness-integrity/issues/05-independent-roles.evidence/role-protocol/attempt-c1f9eaa4-9192-4339-9db4-cad4d5e6ee49/inputs/candidate.diff",
      "digest": "sha256:a02f4674201656df017dd7e70d30614018545a9301cba052cb140effb328d341"
    },
    {
      "kind": "attack-surfaces",
      "ref": ".scratch/harness-integrity/issues/05-independent-roles.evidence/role-protocol/attempt-c1f9eaa4-9192-4339-9db4-cad4d5e6ee49/inputs/attack-surfaces.json",
      "digest": "sha256:b035826a8d07b0b46f9f31afe575f0b401ec1d2d8d482cab86624cf296c37f87",
      "surfaces": [
        {
          "path": "AGENTS.md",
          "class": "changed-surface",
          "origin": "changed"
        },
        {
          "path": "docs/development/independent-role-assurance.md",
          "class": "changed-surface",
          "origin": "changed"
        },
        {
          "path": "package.json",
          "class": "changed-surface",
          "origin": "changed"
        },
        {
          "path": "scripts/agent-context",
          "class": "verifier-or-policy",
          "origin": "changed"
        },
        {
          "path": "scripts/agent-role",
          "class": "verifier-or-policy",
          "origin": "changed"
        },
        {
          "path": "scripts/agent-work",
          "class": "verifier-or-policy",
          "origin": "changed"
        },
        {
          "path": "scripts/bind-role-evidence.mjs",
          "class": "verifier-or-policy",
          "origin": "changed"
        },
        {
          "path": "scripts/finalize-candidate.mjs",
          "class": "verifier-or-policy",
          "origin": "changed"
        },
        {
          "path": "scripts/issue-sync",
          "class": "verifier-or-policy",
          "origin": "changed"
        },
        {
          "path": "scripts/verify-role-evidence.mjs",
          "class": "verifier-or-policy",
          "origin": "changed"
        },
        {
          "path": "spec/schemas/quality-stage-report.schema.json",
          "class": "verifier-or-policy",
          "origin": "changed"
        },
        {
          "path": "spec/schemas/reviewer-report.schema.json",
          "class": "verifier-or-policy",
          "origin": "changed"
        },
        {
          "path": "spec/schemas/role-attempt.schema.json",
          "class": "verifier-or-policy",
          "origin": "changed"
        },
        {
          "path": "spec/schemas/role-attestation-envelope.schema.json",
          "class": "verifier-or-policy",
          "origin": "changed"
        },
        {
          "path": "spec/schemas/role-input-manifest.schema.json",
          "class": "verifier-or-policy",
          "origin": "changed"
        },
        {
          "path": "spec/schemas/role-ledger.schema.json",
          "class": "verifier-or-policy",
          "origin": "changed"
        },
        {
          "path": "tooling/capabilities.json",
          "class": "changed-surface",
          "origin": "changed"
        },
        {
          "path": "tooling/quality/agent-context.test.sh",
          "class": "verifier-or-policy",
          "origin": "changed"
        },
        {
          "path": "tooling/quality/agent-work.test.sh",
          "class": "verifier-or-policy",
          "origin": "changed"
        },
        {
          "path": "tooling/quality/candidate-finalize.test.sh",
          "class": "verifier-or-policy",
          "origin": "changed"
        },
        {
          "path": "tooling/quality/ci-import.test.sh",
          "class": "verifier-or-policy",
          "origin": "changed"
        },
        {
          "path": "tooling/quality/quality-stage-contract.test.mjs",
          "class": "verifier-or-policy",
          "origin": "changed"
        },
        {
          "path": "tooling/quality/role-evidence-policy.mjs",
          "class": "verifier-or-policy",
          "origin": "changed"
        },
        {
          "path": "tooling/quality/role-evidence-policy.test.mjs",
          "class": "verifier-or-policy",
          "origin": "changed"
        },
        {
          "path": "tooling/quality/tool-trace.test.sh",
          "class": "verifier-or-policy",
          "origin": "changed"
        },
        {
          "path": "tooling/roles/prompts/hardener.md",
          "class": "changed-surface",
          "origin": "changed"
        },
        {
          "path": "tooling/roles/prompts/qa.md",
          "class": "changed-surface",
          "origin": "changed"
        },
        {
          "path": "tooling/roles/prompts/reviewer.md",
          "class": "changed-surface",
          "origin": "changed"
        },
        {
          "path": "tooling/roles/registry.json",
          "class": "changed-surface",
          "origin": "changed"
        }
      ],
      "evidence": [
        {
          "taskId": "verify.build",
          "providerId": "builder",
          "exitCode": 0,
          "traceRef": ".scratch/harness-integrity/issues/05-independent-roles.evidence/role-protocol/attempt-c1f9eaa4-9192-4339-9db4-cad4d5e6ee49/inputs/gate-evidence/83620c83-108f-4644-8eb8-986a0a972ef6.json",
          "traceDigest": "4a91faa5de3eb119d3f3b9c94c297dd066b811f6965b4531c194b872be68d682",
          "evidenceRef": ".scratch/harness-integrity/issues/05-independent-roles.evidence/role-protocol/attempt-c1f9eaa4-9192-4339-9db4-cad4d5e6ee49/inputs/gate-evidence/83620c83-108f-4644-8eb8-986a0a972ef6.log",
          "evidenceDigest": "a5cea61925aae2ec86ca3359d06a653d07ea5494cca87d428031213f24ec5f77",
          "dirty": false
        }
      ],
      "candidate": {
        "baseRevision": "40260e2ed3f3ca9251e47c3fd3ec235df2bec4ee",
        "headRevision": "a4833f5d733856662136e862ef9d38f4d2b12ca2",
        "candidateRevision": "sha256:dafdbbc3b7f59069268f1a6c217845a1e1a5942cdcbaa75de43f5a11861838a7"
      }
    }
  ],
  "manifestDigest": "sha256:dc8a6676df2a106aee81b7bda9036e3f71a888fc988a22fe7e1244ce08be33bb"
}
