{
  "schemaVersion": 1,
  "attemptId": "attempt-e0acc653-fafe-48c8-b61d-1f66d8228809",
  "parentInvocationId": "pr64-ci-fix-r2",
  "taskId": ".scratch/harness-integrity/issues/05-independent-roles.md",
  "baseRevision": "6cf6483a0ad65ec65311285f84109133396ab36b",
  "candidateRevision": "sha256:a2d979c450787aa9fedb558db785b13f6856c8fbdbe371642dd94536c6fc3622",
  "implementerId": "codex-role-orchestrator",
  "producerId": "luna-reviewer-64b",
  "role": "reviewer",
  "modelClass": "quick",
  "promptId": "reviewer-v1",
  "promptRef": "tooling/roles/prompts/reviewer.md",
  "promptDigest": "sha256:9f9597af8d9b61ed615baabc3507833005687360640d34030b00350639c900d3",
  "sourceAccessMode": "contract-diff",
  "inputs": [
    {
      "kind": "work-item",
      "ref": ".scratch/harness-integrity/issues/05-independent-roles.md",
      "digest": "sha256:d807e530b68bcdb3e9cee8a4a7f0f2208edaf74b45ae5599f56f9e00174a575b"
    },
    {
      "kind": "candidate-diff",
      "ref": ".scratch/harness-integrity/issues/05-independent-roles.evidence/role-protocol/attempt-e0acc653-fafe-48c8-b61d-1f66d8228809/inputs/candidate.diff",
      "digest": "sha256:01e67b64be7947ea1990b99f7bde81413783e0f69c9b5f4130b1778253cea3e1"
    },
    {
      "kind": "reviewer-context",
      "ref": ".scratch/harness-integrity/issues/05-independent-roles.evidence/role-protocol/attempt-e0acc653-fafe-48c8-b61d-1f66d8228809/inputs/reviewer-context.json",
      "digest": "sha256:1e047113c79a3fda6c4ce0baff684ba458edf59c1e70394e6c2a0412a61a7e8f",
      "context": {
        "schemaVersion": 1,
        "complete": true,
        "affectedSurfaces": [
          {
            "path": ".scratch/harness-integrity/issues/05-independent-roles.md",
            "class": "changed-surface",
            "origin": "changed"
          },
          {
            "path": "AGENTS.md",
            "class": "changed-surface",
            "origin": "changed"
          },
          {
            "path": "docs/development/independent-role-assurance.md",
            "class": "changed-surface",
            "origin": "changed"
          },
          {
            "path": "package.json",
            "class": "changed-surface",
            "origin": "changed"
          },
          {
            "path": "scripts/agent-context",
            "class": "verifier-or-policy",
            "origin": "changed"
          },
          {
            "path": "scripts/agent-role",
            "class": "verifier-or-policy",
            "origin": "changed"
          },
          {
            "path": "scripts/agent-work",
            "class": "verifier-or-policy",
            "origin": "changed"
          },
          {
            "path": "scripts/bind-role-evidence.mjs",
            "class": "verifier-or-policy",
            "origin": "changed"
          },
          {
            "path": "scripts/verify-role-evidence.mjs",
            "class": "verifier-or-policy",
            "origin": "changed"
          },
          {
            "path": "spec/schemas/quality-stage-report.schema.json",
            "class": "verifier-or-policy",
            "origin": "changed"
          },
          {
            "path": "spec/schemas/reviewer-report.schema.json",
            "class": "verifier-or-policy",
            "origin": "changed"
          },
          {
            "path": "spec/schemas/role-attempt.schema.json",
            "class": "verifier-or-policy",
            "origin": "changed"
          },
          {
            "path": "spec/schemas/role-attestation-envelope.schema.json",
            "class": "verifier-or-policy",
            "origin": "changed"
          },
          {
            "path": "spec/schemas/role-input-manifest.schema.json",
            "class": "verifier-or-policy",
            "origin": "changed"
          },
          {
            "path": "spec/schemas/role-ledger.schema.json",
            "class": "verifier-or-policy",
            "origin": "changed"
          },
          {
            "path": "tooling/capabilities.json",
            "class": "changed-surface",
            "origin": "changed"
          },
          {
            "path": "tooling/quality/agent-context.test.sh",
            "class": "verifier-or-policy",
            "origin": "changed"
          },
          {
            "path": "tooling/quality/candidate-finalize.test.sh",
            "class": "verifier-or-policy",
            "origin": "changed"
          },
          {
            "path": "tooling/quality/quality-stage-contract.test.mjs",
            "class": "verifier-or-policy",
            "origin": "changed"
          },
          {
            "path": "tooling/quality/role-evidence-policy.mjs",
            "class": "verifier-or-policy",
            "origin": "changed"
          },
          {
            "path": "tooling/quality/role-evidence-policy.test.mjs",
            "class": "verifier-or-policy",
            "origin": "changed"
          },
          {
            "path": "tooling/roles/prompts/hardener.md",
            "class": "changed-surface",
            "origin": "changed"
          },
          {
            "path": "tooling/roles/prompts/qa.md",
            "class": "changed-surface",
            "origin": "changed"
          },
          {
            "path": "tooling/roles/prompts/reviewer.md",
            "class": "changed-surface",
            "origin": "changed"
          },
          {
            "path": "tooling/roles/registry.json",
            "class": "changed-surface",
            "origin": "changed"
          }
        ],
        "deterministicEvidence": [],
        "candidate": {
          "baseRevision": "6cf6483a0ad65ec65311285f84109133396ab36b",
          "headRevision": "e13838a53625dbb54b786ccb9204055e2a66d525",
          "candidateRevision": "sha256:a2d979c450787aa9fedb558db785b13f6856c8fbdbe371642dd94536c6fc3622"
        }
      }
    }
  ],
  "manifestDigest": "sha256:e3868164cea51fe30a0b097836fde48ab3967c6a9748cdf7c8282ebc0d11b5ee"
}
