{
  "schemaVersion": 1,
  "attemptId": "attempt-5005436e-4312-4425-8ca0-e4d20f686384",
  "parentInvocationId": "promptiris-final4-20260914",
  "taskId": ".scratch/harness-integrity/issues/05-independent-roles.md",
  "baseRevision": "d104a9f3195d9f99b62c76b933c407820dc31177",
  "candidateRevision": "sha256:853f5df7f9529b384e4412b18ea3314f89b5b7a8fb5f4004325f7602960d8f25",
  "implementerId": "codex-role-orchestrator",
  "producerId": "luna-harden-final4",
  "role": "hardener",
  "modelClass": "quick",
  "promptId": "hardener-v1",
  "promptRef": "tooling/roles/prompts/hardener.md",
  "promptDigest": "sha256:cfdc50a75dd9463f10906d4d676ed1bef51f5f5ae78a73777146a000ba28fa42",
  "sourceAccessMode": "attack-surfaces",
  "inputs": [
    {
      "kind": "work-item",
      "ref": ".scratch/harness-integrity/issues/05-independent-roles.md",
      "digest": "sha256:d08c12fe3709b747782e0344fa6af0e1369dae9d3f819d16b796e3d794f06eeb"
    },
    {
      "kind": "candidate-diff",
      "ref": ".scratch/harness-integrity/issues/05-independent-roles.evidence/role-protocol/attempt-5005436e-4312-4425-8ca0-e4d20f686384/inputs/candidate.diff",
      "digest": "sha256:3667b610479ae804a723575bc2bfd447fa2acb42c8682e99ade8e10b8606f4d2"
    },
    {
      "kind": "attack-surfaces",
      "ref": ".scratch/harness-integrity/issues/05-independent-roles.evidence/role-protocol/attempt-5005436e-4312-4425-8ca0-e4d20f686384/inputs/attack-surfaces.json",
      "digest": "sha256:c76f7a1c484b72e31283f9e6e79dce78dd90599e05798ea9d8eecb7e5962ecf0",
      "surfaces": [
        {
          "path": "AGENTS.md",
          "class": "changed-surface",
          "origin": "changed"
        },
        {
          "path": "docs/development/independent-role-assurance.md",
          "class": "changed-surface",
          "origin": "changed"
        },
        {
          "path": "package.json",
          "class": "changed-surface",
          "origin": "changed"
        },
        {
          "path": "scripts/agent-context",
          "class": "verifier-or-policy",
          "origin": "changed"
        },
        {
          "path": "scripts/agent-role",
          "class": "verifier-or-policy",
          "origin": "changed"
        },
        {
          "path": "scripts/agent-work",
          "class": "verifier-or-policy",
          "origin": "changed"
        },
        {
          "path": "scripts/bind-role-evidence.mjs",
          "class": "verifier-or-policy",
          "origin": "changed"
        },
        {
          "path": "scripts/finalize-candidate.mjs",
          "class": "verifier-or-policy",
          "origin": "changed"
        },
        {
          "path": "scripts/verify-role-evidence.mjs",
          "class": "verifier-or-policy",
          "origin": "changed"
        },
        {
          "path": "spec/schemas/quality-stage-report.schema.json",
          "class": "verifier-or-policy",
          "origin": "changed"
        },
        {
          "path": "spec/schemas/reviewer-report.schema.json",
          "class": "verifier-or-policy",
          "origin": "changed"
        },
        {
          "path": "spec/schemas/role-attempt.schema.json",
          "class": "verifier-or-policy",
          "origin": "changed"
        },
        {
          "path": "spec/schemas/role-attestation-envelope.schema.json",
          "class": "verifier-or-policy",
          "origin": "changed"
        },
        {
          "path": "spec/schemas/role-input-manifest.schema.json",
          "class": "verifier-or-policy",
          "origin": "changed"
        },
        {
          "path": "spec/schemas/role-ledger.schema.json",
          "class": "verifier-or-policy",
          "origin": "changed"
        },
        {
          "path": "tooling/capabilities.json",
          "class": "changed-surface",
          "origin": "changed"
        },
        {
          "path": "tooling/quality/agent-context.test.sh",
          "class": "verifier-or-policy",
          "origin": "changed"
        },
        {
          "path": "tooling/quality/agent-work.test.sh",
          "class": "verifier-or-policy",
          "origin": "changed"
        },
        {
          "path": "tooling/quality/candidate-finalize.test.sh",
          "class": "verifier-or-policy",
          "origin": "changed"
        },
        {
          "path": "tooling/quality/ci-import.test.sh",
          "class": "verifier-or-policy",
          "origin": "changed"
        },
        {
          "path": "tooling/quality/quality-stage-contract.test.mjs",
          "class": "verifier-or-policy",
          "origin": "changed"
        },
        {
          "path": "tooling/quality/role-evidence-policy.mjs",
          "class": "verifier-or-policy",
          "origin": "changed"
        },
        {
          "path": "tooling/quality/role-evidence-policy.test.mjs",
          "class": "verifier-or-policy",
          "origin": "changed"
        },
        {
          "path": "tooling/quality/tool-trace.test.sh",
          "class": "verifier-or-policy",
          "origin": "changed"
        },
        {
          "path": "tooling/roles/prompts/hardener.md",
          "class": "changed-surface",
          "origin": "changed"
        },
        {
          "path": "tooling/roles/prompts/qa.md",
          "class": "changed-surface",
          "origin": "changed"
        },
        {
          "path": "tooling/roles/prompts/reviewer.md",
          "class": "changed-surface",
          "origin": "changed"
        },
        {
          "path": "tooling/roles/registry.json",
          "class": "changed-surface",
          "origin": "changed"
        }
      ],
      "evidence": [],
      "candidate": {
        "baseRevision": "d104a9f3195d9f99b62c76b933c407820dc31177",
        "headRevision": "ec9b5b87bb2adf6eb439d55cab8909c08def613d",
        "candidateRevision": "sha256:853f5df7f9529b384e4412b18ea3314f89b5b7a8fb5f4004325f7602960d8f25"
      }
    }
  ],
  "manifestDigest": "sha256:37efcf8832d602e70a9f7871f5992969122dc45bc70c223938a1d3c3d25374ec"
}
