{
  "schemaVersion": 1,
  "attemptId": "attempt-17862c0c-ed89-43c5-8427-5ddb21850807",
  "parentInvocationId": "promptiris-final9-20260915",
  "taskId": ".scratch/harness-integrity/issues/05-independent-roles.md",
  "baseRevision": "40260e2ed3f3ca9251e47c3fd3ec235df2bec4ee",
  "candidateRevision": "sha256:dafdbbc3b7f59069268f1a6c217845a1e1a5942cdcbaa75de43f5a11861838a7",
  "implementerId": "codex-role-orchestrator",
  "producerId": "luna-review-final9",
  "role": "reviewer",
  "modelClass": "quick",
  "promptId": "reviewer-v1",
  "promptRef": "tooling/roles/prompts/reviewer.md",
  "promptDigest": "sha256:9f9597af8d9b61ed615baabc3507833005687360640d34030b00350639c900d3",
  "sourceAccessMode": "contract-diff",
  "inputs": [
    {
      "kind": "work-item",
      "ref": ".scratch/harness-integrity/issues/05-independent-roles.md",
      "digest": "sha256:0768a7fc19ef33520efc117e2aa92f0520a9c842f416be2c7b47b6be29abea66"
    },
    {
      "kind": "candidate-diff",
      "ref": ".scratch/harness-integrity/issues/05-independent-roles.evidence/role-protocol/attempt-17862c0c-ed89-43c5-8427-5ddb21850807/inputs/candidate.diff",
      "digest": "sha256:a02f4674201656df017dd7e70d30614018545a9301cba052cb140effb328d341"
    },
    {
      "kind": "reviewer-context",
      "ref": ".scratch/harness-integrity/issues/05-independent-roles.evidence/role-protocol/attempt-17862c0c-ed89-43c5-8427-5ddb21850807/inputs/reviewer-context.json",
      "digest": "sha256:d05826d5fa93702c3cf50bce1c25f65fe9c60a03281c8808bbf3ceb9dbb9a7ba",
      "context": {
        "schemaVersion": 1,
        "complete": true,
        "affectedSurfaces": [
          {
            "path": "AGENTS.md",
            "class": "changed-surface",
            "origin": "changed"
          },
          {
            "path": "docs/development/independent-role-assurance.md",
            "class": "changed-surface",
            "origin": "changed"
          },
          {
            "path": "package.json",
            "class": "changed-surface",
            "origin": "changed"
          },
          {
            "path": "scripts/agent-context",
            "class": "verifier-or-policy",
            "origin": "changed"
          },
          {
            "path": "scripts/agent-role",
            "class": "verifier-or-policy",
            "origin": "changed"
          },
          {
            "path": "scripts/agent-work",
            "class": "verifier-or-policy",
            "origin": "changed"
          },
          {
            "path": "scripts/bind-role-evidence.mjs",
            "class": "verifier-or-policy",
            "origin": "changed"
          },
          {
            "path": "scripts/finalize-candidate.mjs",
            "class": "verifier-or-policy",
            "origin": "changed"
          },
          {
            "path": "scripts/issue-sync",
            "class": "verifier-or-policy",
            "origin": "changed"
          },
          {
            "path": "scripts/verify-role-evidence.mjs",
            "class": "verifier-or-policy",
            "origin": "changed"
          },
          {
            "path": "spec/schemas/quality-stage-report.schema.json",
            "class": "verifier-or-policy",
            "origin": "changed"
          },
          {
            "path": "spec/schemas/reviewer-report.schema.json",
            "class": "verifier-or-policy",
            "origin": "changed"
          },
          {
            "path": "spec/schemas/role-attempt.schema.json",
            "class": "verifier-or-policy",
            "origin": "changed"
          },
          {
            "path": "spec/schemas/role-attestation-envelope.schema.json",
            "class": "verifier-or-policy",
            "origin": "changed"
          },
          {
            "path": "spec/schemas/role-input-manifest.schema.json",
            "class": "verifier-or-policy",
            "origin": "changed"
          },
          {
            "path": "spec/schemas/role-ledger.schema.json",
            "class": "verifier-or-policy",
            "origin": "changed"
          },
          {
            "path": "tooling/capabilities.json",
            "class": "changed-surface",
            "origin": "changed"
          },
          {
            "path": "tooling/quality/agent-context.test.sh",
            "class": "verifier-or-policy",
            "origin": "changed"
          },
          {
            "path": "tooling/quality/agent-work.test.sh",
            "class": "verifier-or-policy",
            "origin": "changed"
          },
          {
            "path": "tooling/quality/candidate-finalize.test.sh",
            "class": "verifier-or-policy",
            "origin": "changed"
          },
          {
            "path": "tooling/quality/ci-import.test.sh",
            "class": "verifier-or-policy",
            "origin": "changed"
          },
          {
            "path": "tooling/quality/quality-stage-contract.test.mjs",
            "class": "verifier-or-policy",
            "origin": "changed"
          },
          {
            "path": "tooling/quality/role-evidence-policy.mjs",
            "class": "verifier-or-policy",
            "origin": "changed"
          },
          {
            "path": "tooling/quality/role-evidence-policy.test.mjs",
            "class": "verifier-or-policy",
            "origin": "changed"
          },
          {
            "path": "tooling/quality/tool-trace.test.sh",
            "class": "verifier-or-policy",
            "origin": "changed"
          },
          {
            "path": "tooling/roles/prompts/hardener.md",
            "class": "changed-surface",
            "origin": "changed"
          },
          {
            "path": "tooling/roles/prompts/qa.md",
            "class": "changed-surface",
            "origin": "changed"
          },
          {
            "path": "tooling/roles/prompts/reviewer.md",
            "class": "changed-surface",
            "origin": "changed"
          },
          {
            "path": "tooling/roles/registry.json",
            "class": "changed-surface",
            "origin": "changed"
          }
        ],
        "deterministicEvidence": [
          {
            "taskId": "verify.build",
            "providerId": "builder",
            "exitCode": 0,
            "traceRef": ".scratch/harness-integrity/issues/05-independent-roles.evidence/role-protocol/attempt-17862c0c-ed89-43c5-8427-5ddb21850807/inputs/gate-evidence/83620c83-108f-4644-8eb8-986a0a972ef6.json",
            "traceDigest": "4a91faa5de3eb119d3f3b9c94c297dd066b811f6965b4531c194b872be68d682",
            "evidenceRef": ".scratch/harness-integrity/issues/05-independent-roles.evidence/role-protocol/attempt-17862c0c-ed89-43c5-8427-5ddb21850807/inputs/gate-evidence/83620c83-108f-4644-8eb8-986a0a972ef6.log",
            "evidenceDigest": "a5cea61925aae2ec86ca3359d06a653d07ea5494cca87d428031213f24ec5f77",
            "dirty": false
          }
        ],
        "candidate": {
          "baseRevision": "40260e2ed3f3ca9251e47c3fd3ec235df2bec4ee",
          "headRevision": "a4833f5d733856662136e862ef9d38f4d2b12ca2",
          "candidateRevision": "sha256:dafdbbc3b7f59069268f1a6c217845a1e1a5942cdcbaa75de43f5a11861838a7"
        }
      }
    }
  ],
  "manifestDigest": "sha256:a8f8095cf9e72aa1fa0dd7b3ac84bdce6c88ca1cc6c566acd085b7e48cb0bb8f"
}
